{
  "schemaVersion": 1,
  "release": "2.0.2",
  "minimumSupportedSource": "1.0.0",
  "compatibleMajorLine": 2,
  "directFrom": ">=1.3.2 <2.0.2",
  "bridges": [
    {
      "from": ">=1.3.2 <2.0.2",
      "to": "2.0.2",
      "requires": ">=1.3.2",
      "reason": "Owner-preserving personal knowledge migration and explicit memory-tool contract v2."
    }
  ],
  "requiredStops": [
    {
      "when": ">=1.0.0 <1.3.2",
      "release": "1.3.2",
      "reason": "Establish the supported stable updater and snapshot/recovery baseline before the personal-only major upgrade."
    }
  ],
  "coordinator": {
    "minimumVersion": 1,
    "bootstrap": true
  }
}
